{
  "$schema": "https://raw.githubusercontent.com/SubZtep/stt/refs/tags/v0.9.0/config/schema.json",
  "url": "http://localhost:8000/v1",
  "model": "multi",
  "device": "default",
  "bin": "$HOME/.local/bin",
  "container": "speaches",
  "hypr": {
    "config": "$HOME/.config/hypr/bindings.conf",
    "key": "SUPER, grave",
    "mark": ["# >>> stt >>>", "# <<< stt <<<"]
  }
}
